{
  "approved_at": "2026-01-01T00:00:00Z",
  "artifact_snapshot": "a7aec890499096b7cc37788d5c1b1d69dc8b4d023b53791a6b561a0192e9c8fa",
  "decision": "approved",
  "evidence_validation": {
    "artifact_snapshot": "a7aec890499096b7cc37788d5c1b1d69dc8b4d023b53791a6b561a0192e9c8fa",
    "exit_code": 0,
    "gate": "research_to_review",
    "metric_direction": "maximize",
    "metric_key": "score",
    "selected_node": "node-001",
    "validated_at": "2026-01-01T00:00:00Z",
    "validation_mode": "evidence"
  },
  "gate": "research_to_review",
  "reason": "fixture evidence accepted"
}
